{
  "candidate_sha": "aaaaaaaaaaaaaaaaaaaaaaaaaaaaaaaaaaaaaaaa",
  "failed_checks": [],
  "missing_checks": [],
  "observed_at": "2099-01-01T00:10:00Z",
  "observed_check_names": [
    "CI / validate"
  ],
  "pending_checks": [],
  "provider": "github",
  "repository": "owner/repo",
  "required_checks": [
    {
      "allowed_conclusions": [
        "success"
      ],
      "name": "CI / validate"
    }
  ],
  "run_id": "example-run",
  "satisfied_checks": [
    {
      "conclusion": "success",
      "name": "CI / validate"
    }
  ],
  "schema_version": "2.1",
  "status": "PASS",
  "unexpected_checks": []
}
